{
  "$schema":"https://json-schema.org/draft/2020-12/schema",
  "$id":"https://commandf.dev/schemas/af02-tool-lock-v1.schema.json",
  "title":"commandf.af02-tool-lock/v1",
  "type":"object",
  "additionalProperties":false,
  "required":["schema","tool_policy_sha256","source_sha","entries"],
  "properties":{
    "schema":{"const":"commandf.af02-tool-lock/v1"},
    "tool_policy_sha256":{"$ref":"#/$defs/sha256"},
    "source_sha":{"$ref":"#/$defs/gitSha"},
    "entries":{
      "type":"array","minItems":8,"maxItems":8,
      "prefixItems":[
        {"$ref":"#/$defs/arbitrary"},
        {"$ref":"#/$defs/cargoFuzz"},
        {"$ref":"#/$defs/cargoLlvmCov"},
        {"$ref":"#/$defs/cargoMutants"},
        {"$ref":"#/$defs/cargoNextest"},
        {"$ref":"#/$defs/libfuzzerSys"},
        {"$ref":"#/$defs/proptest"},
        {"$ref":"#/$defs/synScanner"}
      ],
      "items":false
    }
  },
  "$defs":{
    "gitSha":{"type":"string","pattern":"^[0-9a-f]{40}$"},
    "sha256":{"type":"string","pattern":"^[0-9a-f]{64}$"},
    "exec":{
      "type":"object","additionalProperties":false,
      "required":["kind","id","version","upstream_repository","upstream_commit","acquisition_mode","source_lock_sha256","installed_executable","installed_executable_sha256","version_output_sha256","build_rustc","build_cargo","build_target","features"],
      "properties":{
        "kind":{"const":"executable"},"id":{"type":"string"},"version":{"type":"string"},"upstream_repository":{"type":"string"},"upstream_commit":{"$ref":"#/$defs/gitSha"},
        "acquisition_mode":{"const":"LOCKED_GIT_REV_SOURCE_BUILD"},"source_lock_sha256":{"$ref":"#/$defs/sha256"},"installed_executable":{"type":"string","minLength":1},
        "installed_executable_sha256":{"$ref":"#/$defs/sha256"},"version_output_sha256":{"$ref":"#/$defs/sha256"},"build_rustc":{"type":"string","minLength":1},"build_cargo":{"type":"string","minLength":1},"build_target":{"const":"x86_64-unknown-linux-gnu"},"features":{"type":"array","items":{"type":"string"},"uniqueItems":true}
      }
    },
    "registry":{
      "type":"object","additionalProperties":false,
      "required":["kind","id","package","version","registry","registry_checksum_sha256","default_features","features"],
      "properties":{
        "kind":{"const":"registry_package"},"id":{"type":"string"},"package":{"type":"string"},"version":{"type":"string"},"registry":{"const":"crates.io"},"registry_checksum_sha256":{"$ref":"#/$defs/sha256"},"default_features":{"type":"boolean"},"features":{"type":"array","items":{"type":"string"},"uniqueItems":true}
      }
    },
    "arbitrary":{"allOf":[{"$ref":"#/$defs/registry"},{"properties":{"id":{"const":"arbitrary"},"package":{"const":"arbitrary"},"version":{"const":"1.4.2"},"default_features":{"const":true},"features":{"const":["derive"]}}}]},
    "cargoFuzz":{"allOf":[{"$ref":"#/$defs/exec"},{"properties":{"id":{"const":"cargo-fuzz"},"version":{"const":"0.13.2"},"upstream_repository":{"const":"https://github.com/rust-fuzz/cargo-fuzz"},"upstream_commit":{"const":"984c861c8dfea28055254c5f1d2659ab2cd63f76"},"features":{"const":[]}}}]},
    "cargoLlvmCov":{"allOf":[{"$ref":"#/$defs/exec"},{"properties":{"id":{"const":"cargo-llvm-cov"},"version":{"const":"0.9.0"},"upstream_repository":{"const":"https://github.com/taiki-e/cargo-llvm-cov"},"upstream_commit":{"const":"be59056988acd54c7f984b7c85643daea3711b29"},"features":{"const":[]}}}]},
    "cargoMutants":{"allOf":[{"$ref":"#/$defs/exec"},{"properties":{"id":{"const":"cargo-mutants"},"version":{"const":"27.1.0"},"upstream_repository":{"const":"https://github.com/sourcefrog/cargo-mutants"},"upstream_commit":{"const":"8ab1dc786a1f61a4e370416cc6c68b81a704e917"},"features":{"const":[]}}}]},
    "cargoNextest":{"allOf":[{"$ref":"#/$defs/exec"},{"properties":{"id":{"const":"cargo-nextest"},"version":{"const":"0.9.143"},"upstream_repository":{"const":"https://github.com/nextest-rs/nextest"},"upstream_commit":{"const":"60fa45f638ffc3f35e74afa65737f45fcd32db2a"},"features":{"const":[]}}}]},
    "libfuzzerSys":{"allOf":[{"$ref":"#/$defs/registry"},{"properties":{"id":{"const":"libfuzzer-sys"},"package":{"const":"libfuzzer-sys"},"version":{"const":"0.4.13"},"default_features":{"const":true},"features":{"const":[]}}}]},
    "proptest":{"allOf":[{"$ref":"#/$defs/registry"},{"properties":{"id":{"const":"proptest"},"package":{"const":"proptest"},"version":{"const":"1.11.0"},"default_features":{"const":true},"features":{"const":[]}}}]},
    "synScanner":{"allOf":[{"$ref":"#/$defs/registry"},{"properties":{"id":{"const":"syn-af02-scanner"},"package":{"const":"syn"},"version":{"const":"3.0.3"},"registry_checksum_sha256":{"const":"53e9bae58849f64dfa4f5d5ae372c8341f7305f82a3868709269343628b659a3"},"default_features":{"const":true},"features":{"const":["full","visit"]}}}]}
  }
}
