{"entries":[{"default_features":true,"features":["derive"],"id":"arbitrary","kind":"registry_package","package":"arbitrary","registry":"crates.io","registry_checksum_sha256":"c3d036a3c4ab069c7b410a2ce876bd74808d2d0888a82667669f8e783a898bf1","version":"1.4.2"},{"acquisition_mode":"LOCKED_GIT_REV_SOURCE_BUILD","build_cargo":"cargo 1.97.1 (c980f4866 2026-06-30)","build_rustc":"rustc 1.97.1 (8bab26f4f 2026-07-14)","build_target":"x86_64-unknown-linux-gnu","features":[],"id":"cargo-fuzz","installed_executable":"/tmp/af02-tools/bin/cargo-fuzz","installed_executable_sha256":"74dc9b35fbb24919762d6d660eb62c38eea64c5b139baea06206cca644e1293b","kind":"executable","source_lock_sha256":"f64e1eceaceb7be6365539911f45d73bfe7b3afc8370281cca943a8a28b395b3","upstream_commit":"984c861c8dfea28055254c5f1d2659ab2cd63f76","upstream_repository":"https://github.com/rust-fuzz/cargo-fuzz","version":"0.13.2","version_output_sha256":"3e2aa5c2baaf44e5a4968cc3fedb864f4717f85b713deacf3fc4294162358ca1"},{"acquisition_mode":"LOCKED_GIT_REV_SOURCE_BUILD","build_cargo":"cargo 1.97.1 (c980f4866 2026-06-30)","build_rustc":"rustc 1.97.1 (8bab26f4f 2026-07-14)","build_target":"x86_64-unknown-linux-gnu","features":[],"id":"cargo-llvm-cov","installed_executable":"/tmp/af02-tools/bin/cargo-llvm-cov","installed_executable_sha256":"93174c8c7dc8c61e0e0afe8a26c1f02ab87c12c806518e0fe9b9a23cfcd15faf","kind":"executable","source_lock_sha256":"8883b1c2a166e37a8e84c69aa91f5375644d7c61710a1185fe5bc683b230599b","upstream_commit":"be59056988acd54c7f984b7c85643daea3711b29","upstream_repository":"https://github.com/taiki-e/cargo-llvm-cov","version":"0.9.0","version_output_sha256":"5372e2711feafe05fff68f8681f01c798a6e5de8c9961d5d373b9a648c1951e2"},{"acquisition_mode":"LOCKED_GIT_REV_SOURCE_BUILD","build_cargo":"cargo 1.97.1 (c980f4866 2026-06-30)","build_rustc":"rustc 1.97.1 (8bab26f4f 2026-07-14)","build_target":"x86_64-unknown-linux-gnu","features":[],"id":"cargo-mutants","installed_executable":"/tmp/af02-tools/bin/cargo-mutants","installed_executable_sha256":"639cb44410299d4226948d0eb59cfe87acdcf9482687c05654917be87806f85c","kind":"executable","source_lock_sha256":"0d2699c31955d28f429731eda2972dc4faced07747320b074bc774c3334f75c0","upstream_commit":"8ab1dc786a1f61a4e370416cc6c68b81a704e917","upstream_repository":"https://github.com/sourcefrog/cargo-mutants","version":"27.1.0","version_output_sha256":"ba3c35073708a1da94eef75cafca1e263013077a73d090b5a798135dac2ffbe5"},{"acquisition_mode":"LOCKED_GIT_REV_SOURCE_BUILD","build_cargo":"cargo 1.97.1 (c980f4866 2026-06-30)","build_rustc":"rustc 1.97.1 (8bab26f4f 2026-07-14)","build_target":"x86_64-unknown-linux-gnu","features":[],"id":"cargo-nextest","installed_executable":"/tmp/af02-tools/bin/cargo-nextest","installed_executable_sha256":"e3affe297797130f8e911669807d0e6a5cd25007b9e92d7ef24e9498053b2153","kind":"executable","source_lock_sha256":"0fdfa6e0d61677857920e40dbdcaf395eb5900902e66b8185599cebe0b982959","upstream_commit":"60fa45f638ffc3f35e74afa65737f45fcd32db2a","upstream_repository":"https://github.com/nextest-rs/nextest","version":"0.9.143","version_output_sha256":"37ea9a38f5f0e0e11223a8fdb3e4669ee447f6403bc153723e33f807f77d02eb"},{"default_features":true,"features":[],"id":"libfuzzer-sys","kind":"registry_package","package":"libfuzzer-sys","registry":"crates.io","registry_checksum_sha256":"a9fd2f41a1cba099f79a0b6b6c35656cf7c03351a7bae8ff0f28f25270f929d2","version":"0.4.13"},{"default_features":true,"features":[],"id":"proptest","kind":"registry_package","package":"proptest","registry":"crates.io","registry_checksum_sha256":"4b45fcc2344c680f5025fe57779faef368840d0bd1f42f216291f0dc4ace4744","version":"1.11.0"},{"default_features":true,"features":["full","visit"],"id":"syn-af02-scanner","kind":"registry_package","package":"syn","registry":"crates.io","registry_checksum_sha256":"53e9bae58849f64dfa4f5d5ae372c8341f7305f82a3868709269343628b659a3","version":"3.0.3"}],"schema":"commandf.af02-tool-lock/v1","source_sha":"7ec61251aa1553e13bf843f8f699894afa96c05d","tool_policy_sha256":"993b6c3458ce64d50cf2fd72731a9431a06732e4e718ab582be38bf1cb253d48"}
